[
  {"event_id": "evt_run_seed42_0001", "run_id": "run_seed42", "ts": "2026-10-08T09:00:00Z", "type": "anomaly_detected", "agent": "quality", "domain": "manufacturing",
   "payload": {"kpi": "defect_rate", "value": 0.062, "baseline": 0.02, "machine": "M02", "shift": "night"}},
  {"event_id": "evt_run_seed42_0002", "run_id": "run_seed42", "ts": "2026-10-08T09:00:05Z", "type": "hypothesis_updated", "agent": "investigation", "domain": "manufacturing",
   "payload": {"group": "Machine", "hypothesis": "M02 spindle wear", "confidence": 0.45}},
  {"event_id": "evt_run_seed42_0003", "run_id": "run_seed42", "ts": "2026-10-08T09:00:10Z", "type": "tool_called", "agent": "investigation", "domain": "manufacturing",
   "payload": {"tool": "query_kpi", "arguments": {"kpi": "defect_rate", "group_by": "shift"}, "ok": true}},
  {"event_id": "evt_run_seed42_0004", "run_id": "run_seed42", "ts": "2026-10-08T09:00:20Z", "type": "question_asked", "agent": "investigation", "domain": "manufacturing",
   "payload": {"question": "Was there a material lot change on night shift?", "attempt": 1, "max_questions": 3}},
  {"event_id": "evt_run_seed42_0005", "run_id": "run_seed42", "ts": "2026-10-08T09:02:00Z", "type": "answer_received", "agent": "system", "domain": "manufacturing",
   "payload": {"answer": "Yes, new lot started at 22:00."}},
  {"event_id": "evt_run_seed42_0006", "run_id": "run_seed42", "ts": "2026-10-08T09:02:10Z", "type": "hypothesis_updated", "agent": "investigation", "domain": "manufacturing",
   "payload": {"group": "Material", "hypothesis": "New lot quality", "confidence": 0.82}},
  {"event_id": "evt_run_seed42_0007", "run_id": "run_seed42", "ts": "2026-10-08T09:02:30Z", "type": "proposal_created", "agent": "improvement", "domain": "manufacturing",
   "payload": {"proposal": {"change": "Add incoming inspection for new material lots", "sop_id": "SOP-INSP-01", "status": "pending"}}},
  {"event_id": "evt_run_seed42_0008", "run_id": "run_seed42", "ts": "2026-10-08T09:05:00Z", "type": "approval_decided", "agent": "system", "domain": "manufacturing",
   "payload": {"kind": "proposal", "decision": "approved", "decided_by": "qa_lead"}},
  {"event_id": "evt_run_seed42_0009", "run_id": "run_seed42", "ts": "2026-10-08T09:05:10Z", "type": "sop_applied", "agent": "improvement", "domain": "manufacturing",
   "payload": {"applied": true, "sop_id": "SOP-INSP-01", "version": 2}},
  {"event_id": "evt_run_seed42_0010", "run_id": "run_seed42", "ts": "2026-10-08T09:10:00Z", "type": "kpi_measured", "agent": "quality", "domain": "manufacturing",
   "payload": {"kpi": "defect_rate", "before": 0.062, "after": 0.021, "passed": true}},
  {"event_id": "evt_run_seed42_0011", "run_id": "run_seed42", "ts": "2026-10-08T09:10:05Z", "type": "learning_saved", "agent": "improvement", "domain": "manufacturing",
   "payload": {"learning_id": 1, "domain": "manufacturing", "content": "Material lot changes on night shift raise defect_rate; incoming inspection restores baseline."}},
  {"event_id": "evt_run_seed42_0012", "run_id": "run_seed42", "ts": "2026-10-08T09:10:06Z", "type": "run_finished", "agent": "system", "domain": "manufacturing",
   "payload": {"status": "completed"}}
]
